{
  "$schema": "https://json-schema.org/draft/2020-12/schema",
  "title": "Worker Result",
  "description": "Structured result returned by pentest-worker subagent.",
  "type": "object",
  "required": ["phase", "batch_id", "worker_id", "status", "targets_processed", "artifacts", "services_discovered", "errors", "duration_seconds"],
  "additionalProperties": false,
  "properties": {
    "phase": { "type": "string", "minLength": 1 },
    "batch_id": { "type": "string", "minLength": 1 },
    "worker_id": { "type": "string", "minLength": 1 },
    "status": { "enum": ["ok", "partial", "blocked", "error", "timeout"] },
    "targets_processed": {
      "type": "array",
      "items": { "type": "string" }
    },
    "artifacts": {
      "type": "array",
      "items": { "type": "string", "description": "Relative path under ${OUTPUT_DIR}" }
    },
    "services_discovered": {
      "type": "array",
      "items": {
        "type": "object",
        "required": ["host", "port", "product"],
        "additionalProperties": false,
        "properties": {
          "host": { "type": "string" },
          "port": {
            "oneOf": [
              {"type": "integer", "minimum": 1, "maximum": 65535},
              {"type": "string", "pattern": "^[1-9][0-9]{0,4}$"}
            ]
          },
          "product": { "type": "string" },
          "version": { "type": "string" }
        }
      }
    },
    "errors": {
      "type": "array",
      "items": { "type": "string" }
    },
    "duration_seconds": { "type": "number", "minimum": 0 }
  }
}
